<?xml version="1.0"?>
<!--
   Licensed to the Apache Software Foundation (ASF) under one or more
   contributor license agreements.  See the NOTICE file distributed with
   this work for additional information regarding copyright ownership.
   The ASF licenses this file to You under the Apache License, Version 2.0
   (the "License"); you may not use this file except in compliance with
   the License.  You may obtain a copy of the License at

       http://www.apache.org/licenses/LICENSE-2.0

   Unless required by applicable law or agreed to in writing, software
   distributed under the License is distributed on an "AS IS" BASIS,
   WITHOUT WARRANTIES OR CONDITIONS OF ANY KIND, either express or implied.
   See the License for the specific language governing permissions and
   limitations under the License.
-->
<upgrade xmlns:xsi="http://www.w3.org/2001/XMLSchema-instance" xsi:noNamespaceSchemaLocation="upgrade-pack.xsd">
  <target>2.2.*.*</target>
  <target-stack>HDP-2.2.6</target-stack>
  <type>ROLLING</type>
  <prerequisite-checks>
    <check>org.apache.ambari.server.checks.HiveMultipleMetastoreCheck</check>
    <check>org.apache.ambari.server.checks.MapReduce2JobHistoryStatePreservingCheck</check>
    <check>org.apache.ambari.server.checks.SecondaryNamenodeDeletedCheck</check>
    <check>org.apache.ambari.server.checks.ServicesMapReduceDistributedCacheCheck</check>
    <check>org.apache.ambari.server.checks.ServicesNamenodeHighAvailabilityCheck</check>
    <check>org.apache.ambari.server.checks.ServicesNamenodeTruncateCheck</check>
    <check>org.apache.ambari.server.checks.ServicesTezDistributedCacheCheck</check>
    <check>org.apache.ambari.server.checks.ServicesYarnWorkPreservingCheck</check>
    <check>org.apache.ambari.server.checks.YarnRMHighAvailabilityCheck</check>
    <check>org.apache.ambari.server.checks.YarnTimelineServerStatePreservingCheck</check>
  </prerequisite-checks>
  <order>
  
    <group name="ZOOKEEPER" title="Zookeeper">
      <service name="ZOOKEEPER">
        <component>ZOOKEEPER_SERVER</component>
      </service>
    </group>
  </order>  

  <processing>
  
    <service name="ZOOKEEPER">
      <component name="ZOOKEEPER_SERVER">
        <pre-upgrade>
          <task xsi:type="manual">
            <message>pre-manual 1 task to run on all hosts</message>
          </task>
          <task xsi:type="execute">
            <script>foo</script>
            <function>bar1</function>
          </task>
          <task xsi:type="execute">
            <script>foo</script>
            <function>bar1</function>
          </task>
        </pre-upgrade>
        
        <pre-downgrade copy-upgrade="true" />
        
        <upgrade />
        
        <post-upgrade>
          <task xsi:type="execute">
            <script>foo</script>
            <function>bar1</function>
          </task>
          <task xsi:type="manual">
            <message>post-manual 1 task to run on all hosts</message>
          </task>
          <task xsi:type="manual">
            <message>post-manual 2 task to run on all hosts</message>
          </task>
          <task xsi:type="execute">
            <script>foo</script>
            <function>bar2</function>
          </task>
          <task xsi:type="execute">
            <script>foo</script>
            <function>bar3</function>
          </task>
          <task xsi:type="execute">
            <script>foo</script>
            <function>bar4</function>
          </task>
          
        </post-upgrade>
        
        <post-downgrade copy-upgrade="true" />
        
        
      </component>
    </service>

  </processing>
</upgrade>
